{"schema":1,"generated_utc":"2026-10-25T19:04:23Z","sources":{"scottish_water":{"ok":true,"url":"https://api.scottishwater.co.uk/overflow-event-monitoring/v1/near-real-time","feed_updated_utc":"2026-10-25T19:01:06Z","assets_in_feed":2071,"tracked_missing":[],"fetched_utc":"2026-10-25T19:04:25Z","error":null},"met_office":{"ok":true,"url":"https://www.metoffice.gov.uk/public/data/PWSCache/WarningsRSS/Region/dg","region":"Dumfries, Galloway, Lothian & Borders","feed_published":"Sun, 25 Oct 2026 15:01:00 GMT","fetched_utc":"2026-10-25T19:04:26Z","error":null}},"overflows":[{"asset_id":"CSO003426","asset_name":"GULLANE WWTW CSO","status_code":"RO","status":"RO - Recent Overflow","start_utc":"2026-10-25T02:05:00Z","end_utc":"2026-10-25T02:55:00Z","duration_min":50.0,"prev_start_utc":"2026-10-25T00:45:00Z","prev_end_utc":"2026-10-25T01:30:00Z","total_min_48h":543.0,"last_transmitted_utc":"2026-10-25T17:05:00Z","receiving_water":"Firth of Forth","local_authority":"East Lothian","lat":56.030814,"lon":-2.8798022,"tracked":true},{"asset_id":"CSO002431","asset_name":"NORTH BERWICK WESTER DUNES WWPS CSO","status_code":"RO","status":"RO - Recent Overflow","start_utc":"2026-10-23T19:55:00Z","end_utc":"2026-10-24T00:45:00Z","duration_min":290.0,"prev_start_utc":"2026-09-23T07:55:00Z","prev_end_utc":"2026-09-23T10:35:00Z","total_min_48h":290.0,"last_transmitted_utc":"2026-10-25T18:05:00Z","receiving_water":"Firth of Forth","local_authority":"East Lothian","lat":56.061566,"lon":-2.7541136,"tracked":true},{"asset_id":"CSO002451","asset_name":"NORTH BERWICK, 1 MELBOURNE ROAD CSO","status_code":"RO","status":"RO - Recent Overflow","start_utc":"2026-10-23T19:55:00Z","end_utc":"2026-10-23T21:20:00Z","duration_min":85.0,"prev_start_utc":"2026-09-23T06:05:00Z","prev_end_utc":"2026-09-23T07:45:00Z","total_min_48h":85.0,"last_transmitted_utc":"2026-10-25T17:00:00Z","receiving_water":"Firth of Forth","local_authority":"East Lothian","lat":56.062346,"lon":-2.7152641,"tracked":true},{"asset_id":"CSO002442","asset_name":"NORTH BERWICK, FIDRA SPS CSO","status_code":"NO","status":"NO - No Overflows","start_utc":"2026-09-23T06:05:00Z","end_utc":"2026-09-23T07:45:00Z","duration_min":100.0,"prev_start_utc":null,"prev_end_utc":null,"total_min_48h":0,"last_transmitted_utc":"2026-10-25T17:05:00Z","receiving_water":"Firth of Forth","local_authority":"East Lothian","lat":56.063523,"lon":-2.7350721,"tracked":true},{"asset_id":"CSO004309","asset_name":"NORTH BERWICK, TANTALLON TERRACE CSO","status_code":"NO","status":"NO - No Overflows","start_utc":"2026-10-03T18:45:00Z","end_utc":"2026-10-03T19:00:00Z","duration_min":15.0,"prev_start_utc":"2026-09-29T07:45:00Z","prev_end_utc":"2026-09-29T11:00:00Z","total_min_48h":0,"last_transmitted_utc":"2026-10-25T17:06:55Z","receiving_water":"Firth of Forth","local_authority":"East Lothian","lat":56.059746,"lon":-2.6969091,"tracked":true},{"asset_id":"CSO006460","asset_name":"ABERLADY GREEN CSO 2000 NT465801","status_code":"RO","status":"RO - Recent Overflow","start_utc":"2026-10-24T17:10:00Z","end_utc":"2026-10-24T17:20:00Z","duration_min":10.0,"prev_start_utc":"2026-10-23T11:00:00Z","prev_end_utc":"2026-10-23T21:50:00Z","total_min_48h":183.0,"last_transmitted_utc":"2026-10-25T16:30:00Z","receiving_water":"Peffer Burn","local_authority":"East Lothian","lat":56.011821,"lon":-2.8591611,"tracked":false},{"asset_id":"CSO002891","asset_name":"ANSTRUTHER, BANKWELL ROAD SPS CSO","status_code":"RO","status":"RO - Recent Overflow","start_utc":"2026-10-24T22:03:37Z","end_utc":"2026-10-24T22:45:00Z","duration_min":41.39,"prev_start_utc":"2026-10-24T16:36:31Z","prev_end_utc":"2026-10-24T17:15:00Z","total_min_48h":246.0,"last_transmitted_utc":"2026-10-25T17:06:15Z","receiving_water":"Firth of Forth","local_authority":"Fife","lat":56.218563,"lon":-2.7028529,"tracked":false},{"asset_id":"CSO006788","asset_name":"BACK DYKES WWPS CSO NT339966","status_code":"RO","status":"RO - Recent Overflow","start_utc":"2026-10-24T16:20:00Z","end_utc":"2026-10-24T16:25:00Z","duration_min":5.0,"prev_start_utc":"2026-10-02T17:45:00Z","prev_end_utc":"2026-10-02T17:50:00Z","total_min_48h":5.0,"last_transmitted_utc":"2026-10-25T17:00:00Z","receiving_water":"Firth of Forth","local_authority":"Fife","lat":56.157321,"lon":-3.0628486,"tracked":false},{"asset_id":"CSO002490","asset_name":"BELHAVEN, BELHAVEN SPS CSO","status_code":"RO","status":"RO - Recent Overflow","start_utc":"2026-10-25T15:21:40Z","end_utc":"2026-10-25T15:22:38Z","duration_min":0.97,"prev_start_utc":"2026-10-25T14:50:26Z","prev_end_utc":"2026-10-25T14:51:25Z","total_min_48h":348.0,"last_transmitted_utc":"2026-10-25T15:22:38Z","receiving_water":"Firth of Forth","local_authority":"East Lothian","lat":56.007144,"lon":-2.5444143,"tracked":false},{"asset_id":"CSO002093","asset_name":"BONNYRIGG, 17 WISHART AVENUE CSO","status_code":"NO","status":"NO - No Overflows","start_utc":null,"end_utc":null,"duration_min":null,"prev_start_utc":null,"prev_end_utc":null,"total_min_48h":0,"last_transmitted_utc":"2026-10-25T17:20:00Z","receiving_water":"Benbught Burn","local_authority":"Midlothian","lat":55.890258,"lon":-3.0684386,"tracked":false},{"asset_id":"CSO002088","asset_name":"BONNYRIGG, B/H 43 ELDINDEAN ROAD CSO","status_code":"NO","status":"NO - No Overflows","start_utc":null,"end_utc":null,"duration_min":null,"prev_start_utc":null,"prev_end_utc":null,"total_min_48h":0,"last_transmitted_utc":"2026-10-25T17:15:00Z","receiving_water":"Benbught Burn","local_authority":"Midlothian","lat":55.890258,"lon":-3.0684386,"tracked":false},{"asset_id":"CSO006816","asset_name":"CAMERONBRIDGE CSO NT347998","status_code":"NO","status":"NO - No Overflows","start_utc":"2026-10-02T17:45:00Z","end_utc":"2026-10-02T17:50:00Z","duration_min":5.0,"prev_start_utc":"2026-06-26T15:05:00Z","prev_end_utc":"2026-06-26T15:15:00Z","total_min_48h":0,"last_transmitted_utc":"2026-10-25T17:05:00Z","receiving_water":"Un-named watercourse","local_authority":"Fife","lat":56.18665677,"lon":-3.05233268,"tracked":false},{"asset_id":"CSO006815","asset_name":"CARBERRY ROAD, LEVEN CSO NO386012","status_code":"RO","status":"RO - Recent Overflow","start_utc":"2026-10-24T21:55:00Z","end_utc":"2026-10-24T22:30:00Z","duration_min":35.0,"prev_start_utc":"2026-10-24T16:30:00Z","prev_end_utc":"2026-10-24T16:45:00Z","total_min_48h":50.0,"last_transmitted_utc":"2026-10-25T17:00:00Z","receiving_water":"Scoonie Burn","local_authority":"Fife","lat":56.19987,"lon":-2.9908349,"tracked":false},{"asset_id":"CSO003549","asset_name":"CELLARDYKE, KILRENNY MILL SPS CSO","status_code":"RO","status":"RO - Recent Overflow","start_utc":"2026-10-24T16:07:23Z","end_utc":"2026-10-25T06:15:00Z","duration_min":847.62,"prev_start_utc":"2026-10-23T12:30:00Z","prev_end_utc":"2026-10-24T16:00:00Z","total_min_48h":2110.0,"last_transmitted_utc":"2026-10-25T17:07:18Z","receiving_water":"Firth of Forth","local_authority":"Fife","lat":56.22995,"lon":-2.6746731,"tracked":false},{"asset_id":"CSO002046","asset_name":"CRAIGENTINNY, B/H 23 CRAIGENTINNY RD CSO","status_code":"RO","status":"RO - Recent Overflow","start_utc":"2026-10-25T01:20:00Z","end_utc":"2026-10-25T02:05:00Z","duration_min":45.0,"prev_start_utc":"2026-10-24T23:35:00Z","prev_end_utc":"2026-10-24T23:40:00Z","total_min_48h":115.0,"last_transmitted_utc":"2026-10-25T18:20:00Z","receiving_water":"Firth of Forth","local_authority":"City of Edinburgh","lat":55.968485,"lon":-3.137676,"tracked":false},{"asset_id":"CSO002055","asset_name":"CRAIGENTINNY, GOLF COURSE CSO","status_code":"RO","status":"RO - Recent Overflow","start_utc":"2026-10-25T02:25:00Z","end_utc":"2026-10-25T02:55:00Z","duration_min":30.0,"prev_start_utc":"2026-10-25T01:30:00Z","prev_end_utc":"2026-10-25T02:20:00Z","total_min_48h":225.0,"last_transmitted_utc":"2026-10-25T17:15:00Z","receiving_water":"Firth of Forth","local_authority":"City of Edinburgh","lat":55.972977,"lon":-3.1309659,"tracked":false},{"asset_id":"CSO002061","asset_name":"CRAIGENTINNY, NANTWICH DR/STAPELEY AVE","status_code":"RO","status":"RO - Recent Overflow","start_utc":"2026-10-25T02:25:00Z","end_utc":"2026-10-25T03:25:00Z","duration_min":60.0,"prev_start_utc":"2026-10-24T23:10:00Z","prev_end_utc":"2026-10-25T02:05:00Z","total_min_48h":508.0,"last_transmitted_utc":"2026-10-25T17:20:00Z","receiving_water":"Firth of Forth","local_authority":"City of Edinburgh","lat":55.972566,"lon":-3.1307296,"tracked":false},{"asset_id":"CSO006793","asset_name":"DALKEITH LUGTON CSO NT329675","status_code":"RO","status":"RO - Recent Overflow","start_utc":"2026-10-24T16:25:00Z","end_utc":"2026-10-24T16:30:00Z","duration_min":5.0,"prev_start_utc":"2026-09-23T05:40:00Z","prev_end_utc":"2026-09-23T05:50:00Z","total_min_48h":5.0,"last_transmitted_utc":"2026-10-25T17:20:00Z","receiving_water":"River North Esk","local_authority":"Midlothian","lat":55.896666,"lon":-3.0735243,"tracked":false},{"asset_id":"CSO002222","asset_name":"DALKEITH, 18 BEVAN LEE COURT CSO","status_code":"RO","status":"RO - Recent Overflow","start_utc":"2026-10-25T00:05:00Z","end_utc":"2026-10-25T00:30:00Z","duration_min":25.0,"prev_start_utc":"2026-10-24T16:25:00Z","prev_end_utc":"2026-10-24T17:05:00Z","total_min_48h":133.0,"last_transmitted_utc":"2026-10-25T17:10:00Z","receiving_water":"River South Esk","local_authority":"Midlothian","lat":55.896771,"lon":-3.0582869,"tracked":false},{"asset_id":"CSO002105","asset_name":"DALKEITH, GILMERTON RD/ELGINHAUGH CSO","status_code":"RO","status":"RO - Recent Overflow","start_utc":"2026-10-25T02:25:00Z","end_utc":"2026-10-25T02:45:00Z","duration_min":20.0,"prev_start_utc":"2026-10-25T00:00:00Z","prev_end_utc":"2026-10-25T00:35:00Z","total_min_48h":258.0,"last_transmitted_utc":"2026-10-25T17:20:00Z","receiving_water":"River North Esk","local_authority":"Midlothian","lat":55.891453,"lon":-3.0808475,"tracked":false},{"asset_id":"CSO002111","asset_name":"DALKEITH, IRONMILLS ROAD CSO","status_code":"RO","status":"RO - Recent Overflow","start_utc":"2026-10-25T02:25:00Z","end_utc":"2026-10-25T02:35:00Z"